[
  {
    "condition_id": "0x1234567890abcdef1234567890abcdef1234567890abcdef1234567890abcdef",
    "question": "BTC above $100k in 2026?",
    "description": "Will Bitcoin price exceed $100,000 USD in 2026?",
    "closed": false,
    "active": true,
    "neg_risk": false,
    "tokens": [
      {"token_id": "1111111111111111111111111111111111111111111111111111111111111111", "outcome": "Yes", "price": "0.45"},
      {"token_id": "2222222222222222222222222222222222222222222222222222222222222222", "outcome": "No", "price": "0.55"}
    ],
    "volume": "1500000.00",
    "volumeNum": 1500000.0,
    "liquidity": "500000.00",
    "liquidityNum": 500000.0
  },
  {
    "condition_id": "0xabcdef1234567890abcdef1234567890abcdef1234567890abcdef1234567890",
    "question": "ETH above $10k in 2026?",
    "description": "Will Ethereum price exceed $10,000 USD in 2026?",
    "closed": false,
    "active": true,
    "neg_risk": false,
    "tokens": [
      {"token_id": "3333333333333333333333333333333333333333333333333333333333333333", "outcome": "Yes", "price": "0.30"},
      {"token_id": "4444444444444444444444444444444444444444444444444444444444444444", "outcome": "No", "price": "0.70"}
    ],
    "volume": "800000.00",
    "volumeNum": 800000.0,
    "liquidity": "300000.00",
    "liquidityNum": 300000.0
  }
]